EmployeeID,EmployeeName,EmployeeEmail,EmployeeRole,EmployeeStartDate,EmployeeEndDate,EmploymentType,ContractType,ContractDetails,PhoneNumber,EmergencyContactInformation,DateOfBirth,SocialSecurityNumber,PhysicalAddress,SalaryInformation,EducationAndQualifications,WorkSchedule,PerformanceReviews,TotalDaysOff,AvailableDaysOff,RemainingDaysOff,DepartmentEmailAddresses,SpecialInformation,InternalRules
384,Christopher Bernard,jessicafoley@example.org,Armed forces operational officer,2021-12-29,2023-09-10,Part-Time,Temporary,"Letter world two in home now couple. Family including get sound.
Region age nor town hear. Series mind report. Authority with dream go others. Meet trial whole especially keep help house station.",(767)941-5920x8,Age hospital network down as still. Detail create often science religious.,1973-04-19,627-89-6670,"40531 Lindsey Skyway Apt. 065
Lake Brittany, VA 25889",36040.73,Picture stand whole. Population season market good Democrat learn speech bad. Religious long wide suffer actually seem.,Be enter today chair board son. Thank evidence people future hot share recent should.,"What its morning cup.
Ten hard Republican least. Teacher town wear knowledge government certainly. Son light book task loss.",2,0,2,evansantonio@example.org,"Sense of yard party. Admit head indicate security you occur western community.
Science carry few account she cell after. Bag between individual.",Consumer meet more something. Them stay girl increase decision. Onto him general place leg contain since about. Daughter start arrive compare.
385,Melissa Parker,loribaker@example.org,Chartered legal executive (England and Wales),2021-05-23,2022-12-13,Full-Time,Temporary,"Leave simply great forget best evidence. Claim send key question discover wait.
Record everything others and system century small. Join name official on who raise only claim.",+1-525-856-4129,"Share generation include bag.
Energy no process material hair.",1997-07-15,785-29-5425,"506 Lopez Fields Suite 744
Jamesstad, AZ 27607",37684.73,"Appear nation everybody treat. View theory to probably. Enough leave technology system score father argue.
Fine language special those.",Most history or sure. Trial particularly forget occur. Community hard third put.,"Her keep various thus stage off beautiful. Significant laugh candidate effect watch individual. Explain lead place let view this interesting.
Even five concern need. Anything or actually eight.",8,4,4,dmiller@example.com,Him red popular note agreement issue party. Serve American rule somebody question building. Sort about fire season bed. Land work necessary lose without friend story.,"Billion practice Democrat. Guy perform boy game commercial book.
Professional politics picture land south discuss. There media each ask."
386,Rachel Peterson,jacquelineoconnor@example.com,Sales promotion account executive,2023-12-26,2024-01-08,Contract,Internship,Would just service. Media quality business drop down physical. Couple wear night range.,(610)442-6530x3,Reveal realize citizen so take. Although beyond campaign fine store. Job necessary pick.,1961-04-06,100-37-8084,"5327 Aaron Court
Lake Jennifer, NM 23605",68104.67,"Agreement certain word decide. Total southern type offer down consider she store.
Friend conference they begin cup whole image. Then too couple fear card soldier sure. Control third carry now.",Billion off current campaign. Minute miss news whole. Many blue carry she rule.,Often our minute water across size. Nation song try customer about indicate.,2,2,0,carlos62@example.net,"More add husband some summer few weight.
Simply group expert who point television difficult. Call behind sell international. Summer century wide happen. Meet player establish anyone.","Role company upon analysis car build station. North middle that discover kid.
Voice hard again. Often rule reveal ground gas. General girl population east budget interview office."
387,Paige Lewis,ufreeman@example.org,Surgeon,2021-05-16,2022-07-11,Full-Time,Internship,"Executive first become kid finish. Follow other low become short trial. The run project join safe.
Series age executive skin. Physical act often section. Almost business painting fill action box.",9399200694,Fact according real per industry. Little require science fire.,1991-05-03,131-59-4055,"PSC 5278, Box 8026
APO AA 80393",71933.60,"Eight become item truth. In process listen type former.
Woman for one common science. Focus cultural spring accept hundred. Partner western nothing high.",Need group prove deep discover left thousand. Perhaps way century whose specific natural.,"Important action on own your. Energy military sister picture. Leader check adult determine. Appear carry program fly tax.
Cause as affect no plan. She under analysis material.",27,12,15,johnsondavid@example.com,"Stuff kid alone your. Bill begin method energy start heart any. Onto better fast standard claim.
Situation laugh wear news make. Drop analysis even often or exactly sell now.
Pattern nearly hard.",Small Democrat service scientist main leader. Back trouble near hair yet always.
388,Jeremy Smith,juliemitchell@example.net,Regulatory affairs officer,2020-01-31,2021-01-18,Full-Time,Temporary,"Break gun also population culture. Western billion discussion compare meeting data in.
Break check significant increase brother rest. It rest about do. Moment middle station value argue sing.",(854)537-6552x6,Natural dog argue as tough. Wall spend policy always decide message issue.,1978-01-23,233-35-2213,"866 Jenkins Fork
Chelseaton, OK 22040",88001.38,"Rock happen hard. Radio far environmental husband hard view no. Effect would ago yes decide.
All sister act reason practice. Investment activity section exist able up approach. Write plan how meet.",Until economy type tough certainly bit task. Economic avoid issue trip best box receive.,Law listen myself policy serve. Hit strategy field wonder whom time human.,16,15,1,jhughes@example.com,"Life find base. End carry official wide forward.
Somebody she exactly specific involve serve again visit. Including however wife. Long very receive from other up figure.",Level anyone between education nor deep. Enough page interesting scene send fly heart.
389,Fred Butler,vancejason@example.org,Geophysical data processor,2020-12-27,2021-10-07,Part-Time,Temporary,"Summer product beyond. Arm standard who position. Young moment clear agree.
Pm consider chance eye read. Day field also politics care point contain. Subject happen answer affect dark both.",754-448-4875x01,Nation north soon relationship himself relate. Church miss often increase.,1969-06-25,863-91-1862,"589 Johnson Lakes Apt. 466
Jessicafurt, CA 56785",85322.20,Democrat edge authority traditional campaign red page work. Require notice thus officer.,Improve Republican fine born group. Money down participant law.,"Officer effect mind on. Morning season energy small.
Number in federal see character ask owner. Other improve plan threat way.",4,2,2,scottcarson@example.org,Military figure how newspaper small reach. Activity impact great clearly much catch. Look cup suffer blood outside food.,"Almost find tax no world step. Group strategy deep head phone hold.
Air goal administration special. Personal standard method she however cultural goal. How generation back."
390,Joshua Nguyen,ysimpson@example.net,Recycling officer,2022-12-19,2023-05-18,Full-Time,Permanent,"Authority tonight because wonder. Arrive issue who out organization range. Pm everybody foot travel.
Without if stop street between.
Plan computer order detail. Leave meet police how maybe throw.",001-938-361-277,Writer view window. Large occur level apply down above. Over remain campaign tend.,2003-09-14,580-67-8947,"4337 Michael Estates
Carrolltown, MA 22027",99142.29,"Money according sit pay police. Serve need business change. Everything election course decide agency debate beat.
System cause man six daughter. Myself later science. Adult type will partner right.",East bar current. Themselves wonder west.,Call it would camera either federal yourself. Car include government form interview still training. Wall different throughout fear eye read.,3,0,3,sblevins@example.net,Involve although fight his issue. Boy dream right spring turn mission experience speak.,"Pick bit himself. Author reason member future already.
Father wait value every answer. Dog whole low law wall. Hear choice chair produce financial. Heart pass avoid special single open."
391,Amanda Glover DDS,cynthiabrown@example.org,Theatre stage manager,2019-04-30,2024-02-08,Part-Time,Permanent,Itself those language day federal cover. Art hope history a understand quality class local.,+1-204-948-3013,Opportunity operation music show career.,1963-05-27,262-57-6402,"Unit 6900 Box 7673
DPO AA 82700",57853.67,"Nor cell tell. May size hope.
International firm bill number answer the. Peace best industry dark describe.",Newspaper recently especially huge left officer continue. Interview step threat brother most.,"Trade throughout less game skill product. Above interesting program per paper energy community today. Style food call result house.
Woman front receive card offer. Quite camera will whole.",17,5,12,tonya19@example.org,Free from board recently apply. Read test senior instead.,Individual improve partner worker indeed especially system analysis. Goal ago name off consider mouth.
392,Shelley Smith,emilyhendricks@example.net,Scientific laboratory technician,2022-11-24,2023-02-26,Full-Time,Permanent,Chance machine which. Matter city bank exactly. Dream design candidate civil cut test assume.,(253)588-9367,Cover tough live ability return wish tough.,1996-10-23,589-07-0884,"25709 Snyder Brooks Apt. 172
Batesmouth, LA 30876",56150.02,Speech son upon maybe. Section all I particular perhaps policy. Result summer suffer receive.,"Even similar lead statement sit.
Similar news car article break. Find because determine goal owner.","Difficult wall much state protect if feeling man. If necessary question want message.
Forget American training air central pattern. Teacher manage set maintain. Oil sell issue film.",7,0,7,carol73@example.org,"With current present thought table family particularly method. Left drug serve south. Like ball expert then matter body.
Choose politics when push. Wish wish real.","Between race month special. Everything traditional push including off turn rock.
Own question address happen. Region eye win painting."
393,Sandra Johnston,bduffy@example.net,Geophysical data processor,2022-08-11,2023-08-31,Part-Time,Temporary,"Land anything center organization left. Cause wrong student quality nearly hospital.
Drop school good door activity hair issue trade. Wind design stand agency. Policy how look country cut.",+1-935-372-3418,Body finally there just note. How then provide respond.,1991-01-26,885-34-7538,"2206 Hunt Light Apt. 182
Lake Robert, PA 59797",96165.14,"Ever pressure rate learn strong respond score give. Media kid name no house. Reduce miss policy drop will evidence third.
Treatment court economic safe factor.",Keep test account trip research. Budget fact back begin hard just necessary. One imagine statement.,Even we also whole some. Majority trouble assume explain section bag. Position read figure ready simply bring citizen.,27,15,12,edwardryan@example.com,"Meet pick likely give. Recent fire figure issue open life.
To effort Congress use majority. Support what lay black case house bit. Cup prove image hear drop can to book.","Window half leave left ball change. Exactly like already generation. Share surface full speech hit security everything ask.
Eat agree spend dream. Political try improve include decision."
394,Daniel Carroll,gcrawford@example.org,Water engineer,2021-07-05,2023-02-25,Part-Time,Permanent,Voice produce must since country man property relationship. Represent enjoy need beautiful. Word radio father lawyer body arm teacher story.,7706096244,Such fear newspaper light add. Want understand travel thought.,1963-05-15,361-62-3142,"43102 Regina Lake Apt. 788
Websterland, NY 29378",55930.45,Nice reduce student task human daughter piece. Father these west wonder recognize fly.,Item can and hot indeed. President popular debate seek talk read prevent.,"Voice discover successful. Grow later send individual.
Never long seek trouble. Tax gas the as detail else born.
Pass job treatment simply near article a.",5,2,3,erikawhite@example.net,"Hot six again similar month show experience have. Stage choose big speech high rise by.
Reduce mission early any account investment. View recognize activity attack more.","Goal surface against. Admit growth create here trip determine.
Nearly medical activity third itself. Assume continue goal do cost inside. Determine oil trade direction increase politics draw."
395,Holly Pacheco,ericfernandez@example.com,"Surveyor, hydrographic",2023-08-29,2024-01-12,Part-Time,Temporary,"Large kid way political safe hospital remember. Them account themselves information more director. How get such simply whole that.
Moment work eye back real free.",685.503.9935,Population art beat. Ten half official western while policy. Place someone continue also spring.,1994-01-07,331-76-8190,"669 Walter Circle Apt. 011
Briannaberg, MS 85280",83875.28,Dinner cause college try on animal citizen. Speech perform head person no. Including policy watch probably board school.,General live return cup range. Prove message note not dark chance top. In sea price inside how.,"Base son remain red run only treatment. Those wrong find high myself.
Second why save build course Republican will. Television perform fight for.",9,0,9,johnrios@example.net,"Full every like. As second look financial dinner sometimes.
Arm company college leave want. Identify loss decide race glass Democrat. Never science finish fear.","Final into sound new positive good. Seek will reflect our computer. Song cause without nearly similar however develop.
Might size increase thank side get leg."
396,Katherine Walton,zmorris@example.net,Accounting technician,2023-10-30,2024-01-10,Contract,Permanent,"Center song your move. Choice cell quite represent rise total forget.
Admit hotel president close. Source serve either trade without town speak.
Ability cover environment body.",(207)504-6906,Do particularly bit. Almost group field drop far board color power.,1959-03-21,142-67-4763,"538 Mark Ramp Apt. 339
Stephenchester, IN 46581",78886.17,"How yes ahead full recently buy mention. Certainly upon beyond officer.
Offer customer remain now continue try field. Choose instead middle theory board themselves rule we.",Character could president any box.,"Professor full fight discuss debate room strategy. And production why argue.
Friend risk season difficult American have head. Base fact chance property inside.",25,11,14,joshuahernandez@example.net,"Tonight look low few we word western. Debate season professor allow.
Difficult available land peace budget subject tonight structure. Specific his ten team.",Or dinner Congress teacher we institution. Too station piece responsibility may. Pattern your power sell.
397,Tyler Le,heather27@example.com,"Teacher, secondary school",2023-10-05,2024-02-11,Part-Time,Internship,"Pm build morning education boy actually. Discover wonder glass.
Interesting executive senior. Choose real many it. Service key drug hit sign.",309.424.2420x89,Early case whole. Someone politics road about force important.,1972-04-10,812-09-9945,"6651 David Fork Suite 756
West Tabithaview, VA 22225",44344.17,"Central pressure more each loss idea off.
Image bad born. Around card democratic week toward.
Above summer investment each price rock individual.",Beat certainly effort over see north. Pass daughter lay draw soon.,Raise whose perform. Lay laugh reason during market leg those. Reflect professor ground add from.,23,3,20,jasonswanson@example.net,Receive join help. Population carry visit firm attack. Director sometimes away lot television himself.,"Can plan politics player. Thought hundred past break consider. Pretty base else simply hope everyone.
Culture bill turn agree goal."
398,William Tucker,jasongrant@example.net,Broadcast engineer,2022-05-12,2023-09-23,Contract,Temporary,Situation performance walk key politics shoulder sign. Small ever nor create two discuss support quite. Determine above court central health tell.,(417)612-3225,Forget thousand by often manager. Well seat media. Probably nearly they value water front listen.,1965-03-14,332-47-7047,"72754 Amber Wells
Trujillotown, OH 57554",81816.75,"Goal share her teacher agree. Chance range arrive suggest. Able house TV.
Old down push history guy beautiful. Budget five have forget focus.
Mrs treatment window strong. Staff nice full.",Method wonder or result send sea. Hold hit action activity economy court.,"Short amount central teach yard see where. Rock paper management position talk federal. Report center radio especially thus appear.
Mission seat offer reveal.",12,0,12,nicolehart@example.org,"Individual get do bill. Deal discuss agent suggest off push laugh. I sign boy kid.
Treatment billion glass pay body. Agency eight start little wall ten. Within billion it give visit sort.",Central woman lot every once. Believe positive what direction performance owner budget another. Only one experience describe same Mrs company red.
399,Stacey Garcia,stacy37@example.net,"Engineer, technical sales",2022-03-25,2023-03-17,Part-Time,Temporary,"Deal than four up so. Economic which increase.
Knowledge actually better million. They stop price magazine first full figure.",876.210.6407x34,Cell foreign drug agent. Live single sure up account.,1981-06-15,375-26-7750,"23785 Barry Turnpike Suite 430
West Paul, RI 33334",78014.54,"Than be pull.
Always Mr produce cell specific system three. Too series scene protect.
Second respond miss animal specific world drop. Every others ok chair half we.",State person assume blood also. Per short safe interesting herself.,"Building write guy certain brother western security. Fast single soldier.
Mention carry production include employee benefit window. Imagine oil decide quite. Husband cost ready sometimes.",17,6,11,whitetyler@example.net,Story second gas manage single drug. Activity pretty fast late identify can relate. Republican cause many structure order bed. Tax whole represent rule open push manage song.,Authority grow weight focus brother minute help. Better degree pick send contain create do.
400,Lauren Randall,jensenamber@example.org,Financial trader,2019-09-30,2019-10-25,Contract,Permanent,"Term red pull move. Serious southern part treat. Nor notice fish forward.
Rock check onto degree young. Account participant live list food. In collection friend street argue base finish.",7016156568,Able be site could. Father central else nice. Sound support tend sport stay turn popular.,1981-08-11,728-16-9154,"500 Jennifer Mountain Suite 214
Nicholasshire, MI 18218",97664.96,Close fish decide simple cultural interview. When the save rich. Reality behavior difference interview probably surface employee quality.,Gas speech skill spend protect message. Realize go whether see home health.,Entire ground language world us. Certain live production stuff forward maintain ten. Could physical present catch.,21,20,1,mreeves@example.com,"Government between growth specific door not.
Break bit experience enough suddenly life effort admit. Game author south newspaper series call. Almost shoulder trouble occur marriage by result.","Heavy address keep Mr rather identify group. Economic who close talk take part discussion.
Cover drop operation where as public. Stock job wrong nice big."
401,Jasmine Mooney,smithtina@example.com,Geophysicist/field seismologist,2023-02-04,2023-11-30,Contract,Permanent,"Sign hear condition should hard. Necessary street kitchen recently culture course.
Establish issue identify admit series. Risk job window enjoy strategy charge drug. Want market coach take structure.",282.588.2630x81,"Administration whatever move board.
Writer girl beautiful unit. Bag while eye when daughter.",1988-04-14,520-07-2496,"9546 Daniels Neck
Westberg, KS 28079",71078.23,Learn media protect follow. Floor kid range raise experience leave reduce. Song religious unit everything.,Central increase may sea free church catch.,Sure thing entire mention east mind own. Law choose cold discuss yard. Rock one smile seven local these. New radio who usually stand.,16,16,0,vhenson@example.net,"Live fly unit. Last media prevent. Themselves family friend series decide popular agree.
Free car reduce quality. Republican involve ability laugh. Many smile soon single order structure.","Everyone according short situation. Management charge chance hot buy report mind.
Model direction also north maybe. Be success recently."
402,Brandon Welch,nathan85@example.com,Music tutor,2020-08-28,2021-12-29,Full-Time,Permanent,"Mention people threat candidate maintain issue assume.
Design these eight remain doctor practice girl.
Bed political store form method seek manage. Some thousand enjoy minute.",+1-829-410-8851,History theory movement pretty up. Create especially soon such gun.,1976-01-16,779-20-1462,"576 Ford Station
Katherinemouth, TX 12792",70247.66,Say ready either how name network. Material page office start group note process. Environmental hit sister institution.,Game probably smile natural staff animal stand. Gun hour somebody way save catch pull.,Candidate Mrs close challenge heavy sound computer bit. Tend city long general current. Mrs deal boy unit require pull.,4,3,1,myerssabrina@example.com,"Day guess share town. Long one and dinner.
Weight watch ago where response door life. New role third social yes offer skin.","Family role debate. Month seat give world.
Able race continue everybody actually similar.
Agent explain develop reason try support. Many assume story reality itself on. Drug phone far situation."
403,Erica Rose,dacevedo@example.net,Private music teacher,2024-01-18,2024-02-06,Contract,Temporary,Leave team early green art news. Single attorney any stuff although maintain relationship. Attorney fire choose it.,(536)456-3286,Anyone even know. Write upon other nothing gun budget save.,1979-03-14,319-02-9765,"161 Vanessa Wells
East Rodney, FL 42287",81362.78,"Detail certain Congress bill country represent. Traditional system recently night. Forget firm month.
Significant why necessary this recent. Environment color little clearly of learn consumer.","One edge poor forward evidence we no. May analysis mind.
Office purpose day can near sometimes.","Eye media shake course class. In federal shake alone type energy. Late develop institution citizen push audience sing. Network local herself son.
Century hotel put. Stage mother north outside.",13,4,9,kimberlymason@example.org,Charge building someone candidate bed. Lot model become concern this. Determine opportunity trouble sport alone law.,"Against however to main figure. Theory least together seat onto have as room. That evening partner career behind follow bag.
Hard good staff surface. Book federal truth ask his address."
404,Tony Mata,williamsheather@example.net,Tour manager,2022-11-27,2023-12-27,Part-Time,Internship,Give page return third worry trade she. Much when skin. Newspaper science office free through road peace.,389-593-7117x80,Price where read out. Mrs site kitchen animal. Among growth identify explain.,1966-09-10,244-51-8695,"5542 Emma Island Suite 140
West Bethberg, MH 90225",94129.77,"Cover western already color. Mean him weight party.
Check economy different reason natural shoulder. Capital local language win. Number very its southern beautiful million.",Realize event husband raise difference. Budget area old authority build field sense.,Professor still letter public. Consider travel media. However on author suffer.,17,8,9,adrian89@example.net,Manager environment measure again sea figure. Speak chair discussion indicate together where trial. American close relationship score season draw explain baby. Treat out at artist hospital.,"Chair then outside bring oil can. Arrive owner career station positive back.
Measure employee single significant lot. Around note success laugh law responsibility."
405,Alvin Lopez,martinezmichelle@example.com,Mechanical engineer,2020-02-21,2022-11-09,Full-Time,Temporary,"Remember sing accept fill. Son expert street always south political. Dinner keep poor rule chance.
Side green range must. Offer institution fire.",377.635.5936x02,International bag billion. Follow history response he.,1998-02-18,736-44-4569,"568 Mariah Forge Apt. 093
East Michaelville, NV 68411",51295.12,"Property offer character best with bill. Base among assume hot expert. Return region scientist consumer seat. Hundred meet mission past whole save.
Grow price performance.",Wonder human owner. Industry son phone other inside.,Executive catch international. Establish great suddenly sure. Network current marriage treat south.,16,12,4,kimberlywilliams@example.net,"American material everybody age three foot bed city. Agree book late age writer.
Southern long statement rock conference. Police this analysis. System entire news.","Chair pass according trouble dark should. Company discover board.
Today owner themselves. Away beyond trade toward staff. Simple letter whose eight oil."
