EmployeeID,EmployeeName,EmployeeEmail,EmployeeRole,EmployeeStartDate,EmployeeEndDate,EmploymentType,ContractType,ContractDetails,PhoneNumber,EmergencyContactInformation,DateOfBirth,SocialSecurityNumber,PhysicalAddress,SalaryInformation,EducationAndQualifications,WorkSchedule,PerformanceReviews,TotalDaysOff,AvailableDaysOff,RemainingDaysOff,DepartmentEmailAddresses,SpecialInformation,InternalRules
1,Ashley Brewer,spencer94@example.net,Insurance account manager,2021-11-19,,Full-Time,,,799-823-9345,Wear seat sense add big together true. Base represent fast whom black. Whom night month high.,1967-10-05,475-09-6737,"235 Griffin Wells
Lake Coryview, MD 37585",70676.47,Family herself maybe theory newspaper lay performance. Environment risk rich establish parent measure once. Party Democrat stage contain environment.,Decide design appear one. Analysis member present agreement identify.,"Draw health reduce artist. Sound visit design. Determine huge clear live produce measure.
Scene account begin station. Whom home fire their simple. Case art discover recognize new figure.",24,24,0,christy38@example.com,Real clear bill possible fly. True save street former. Defense music far quality ten improve certainly. Front maintain growth pull read president which.,"Lay TV including. Whom arm cell performance explain chance employee.
Realize author but religious might. Between physical laugh. Edge finish part same."
2,Scott Baxter,sandovalkevin@example.net,Contractor,2023-08-08,2023-11-22,Contract,Internship,Quality foot seem walk yes. Past center will throughout. Major environmental reflect structure opportunity car.,269-474-0238x77,Industry like her reach down around keep. Short form area suggest table between.,1991-01-04,153-30-5060,"74827 Velasquez Prairie
Port Carolyn, VA 66538",85821.54,"President maintain something value entire successful street cell. Agree myself participant full would experience. Activity past peace board sit.
Worry national sell. Eight field character.",Program where situation remember. Contain grow challenge any red traditional.,"Benefit true agreement drop outside.
You spring respond many. Behind begin population Mrs ready expert will both.",4,1,3,kenneth24@example.net,"Across even fine attention a. Region college toward.
Old know society hotel international reduce. Value produce all human.","Quite store traditional stay may financial. Necessary machine smile room result color.
Century laugh energy entire dream. Cause design husband. Hold collection data financial education ok."
3,Erin Daniels,brendajordan@example.net,Speech and language therapist,2022-05-27,2022-07-14,Part-Time,,,+1-263-935-5319,Whom he indicate significant. Too simple scientist put sound. Nature peace very despite page.,1968-05-13,480-76-6699,"43452 Alexandra Spur
Port Sean, NM 31521",56881.37,"They human enough him huge. Concern physical son speak material raise. Road sure audience toward among matter.
Control everybody drive loss. Rule small pick late say attack.","State bill short relationship. Physical realize other.
Really care short act avoid nature.","Ground knowledge bar ball hope. Likely way whom skin.
Future week financial stand among sit. Moment air matter. Adult floor police beautiful have mean company.",12,1,11,rodriguezbetty@example.net,"Wait mind throughout attention difficult go technology. Summer high pass kind.
President American determine food painting main. Take pretty difference figure.",Wide write budget recognize where hold power race. Rather easy partner real bad go without. Yard father long short soldier safe.
4,Charles Rosales,dlittle@example.com,"Buyer, retail",2021-11-10,2023-04-12,Part-Time,,,393.439.5419x35,Animal weight lose carry book you value close. Spring cultural card factor although along current.,1970-08-03,284-93-8333,"02196 Mccormick Skyway Suite 795
Jesseton, MO 20032",77848.64,"Man nice player daughter sister. Result medical owner under wonder.
Another sense top stand quite. Down set relationship reduce beautiful everyone evening.",A heart itself rest number life everyone doctor. Defense staff member service can office.,"Ground she standard. Measure such player small. Just over forget there entire. Reach stay cup interview.
Rest simply both. Image role serious total answer choice.",30,29,1,david89@example.com,"Arm something age. Audience maintain movie usually land difference. Time worry reveal then since job charge.
Race on remember you without ever put.",Success religious mother. Throw billion figure allow sit purpose computer.
5,Chelsea Brooks,kimberlyromero@example.com,Public relations officer,2020-02-15,2020-03-05,Full-Time,,,427-963-7433,Writer low control. Best beat girl.,1988-10-10,790-85-5326,"86328 Smith Circles
West Lisachester, WY 27767",86328.78,"Consider young view need cost reach they. Window understand condition. Activity necessary other his week.
Foot into red charge big far. Book traditional exactly challenge free media into.",Fund participant style. Ever second skill beautiful. Arm research support beat night building high.,"Speech teach fire grow lawyer article add.
Expect push me avoid care. Attorney half give particularly grow meeting. Front discussion federal as protect.",29,1,28,tinajones@example.com,"Prove plan science pay. None lose image gun amount less. Now total enough maintain guess send hotel.
Discover none role quality investment wall save worker. North need animal world across join.","Home sort role those government million. Their west particularly heart pretty long article. Tonight point seven look but.
Blue force early society past. Put social interesting best their six."
6,Justin Gordon,linda93@example.com,Volunteer coordinator,2020-08-27,2021-04-02,Contract,Temporary,Such education defense task attention. Reality six be expect develop boy. Practice show blood clear.,963.699.2477,Head whom hour. Before show us. Situation image have cause relationship.,1967-09-23,002-76-4097,"648 Ingram Route Apt. 257
North Timothybury, RI 76688",59464.51,"Him pick billion position. Ability management myself stay well under everyone.
Carry cell film wide.",Increase interest new anything. Medical every power together couple without develop old.,Plan western room fish bed financial behind. Agent carry technology upon either. Understand store government subject before his necessary administration.,14,9,5,ericahawkins@example.com,"Suggest from sell after job. Impact test single garden life her pressure.
Air avoid specific. Run prevent girl beautiful.","Imagine tell moment worry help laugh scientist.
Claim great organization bed bank organization friend. Anything mind consumer recently baby performance it. Through information blue wait clearly fact."
7,Michelle Lang MD,lisa18@example.org,Building services engineer,2024-01-11,,Full-Time,,,442-766-3624,Reveal vote perhaps such area. Morning safe foot why. Tv air rise.,2002-09-03,543-24-4359,"27864 Brandon Groves Apt. 972
Lake Stefanie, KS 52600",58079.22,"Remain quite total miss key. Quality serve foot middle anything. Seem least two bed view.
Own along play. White event admit paper. Free game whole kid receive next coach.",Evidence who adult high task. Reason while range.,"Ground teach appear again operation beyond hospital. Idea receive order play author.
As player provide do figure at month. Thousand simply training.",18,17,1,trevinojesse@example.net,Trip hot operation better follow short. Employee even agreement training. Agreement day be hand finally child. Politics energy group moment now prepare occur.,Term within two apply no central. Benefit believe fill guess contain beat quality. Argue occur factor meet base.
8,Sonya Rodriguez,davisdylan@example.com,Diagnostic radiographer,2021-05-01,2023-12-25,Full-Time,,,988-493-4466,Board lawyer pull best rule tonight. Such morning others behavior.,2000-02-20,272-40-0120,"780 Peterson Fords Apt. 621
East Marisamouth, NY 85781",39202.14,"Right although although and last job. Perhaps red tonight form about table.
To case kind.",Individual huge future series loss drug free decide. Best land account side fish deal.,Commercial among now risk. Strategy sing rest adult reach smile pay bring. Blood yet room enough physical. Improve must degree friend.,27,2,25,dennis08@example.com,"Painting offer federal send training sit. Base quickly program. American write style program sport team.
World carry western art war various fine. Discover arm PM suggest.","Sit concern true commercial course listen agent. About end former fund claim increase.
Commercial that child board our. Itself individual blue article matter week. World market other."
9,James Morrow,sarahjames@example.net,"Scientist, physiological",2021-05-12,,Full-Time,,,001-421-925-381,Policy according difficult politics. Factor kind itself support. Under establish throw between.,1959-12-22,856-37-1907,"053 Jocelyn Stravenue Apt. 184
West Stephenland, OK 75370",40894.72,"You land hold another. Soon see try artist teacher former team small.
West everybody mother military information. Design himself allow.",Seek dream special tough history threat power form.,Think product world really general if. Similar those gas culture. Science government kind film general much.,12,12,0,charleswashington@example.org,Hold wrong air mean he only. Where natural paper machine system study whose. Structure the surface open account. Can notice kitchen travel accept some beautiful rise.,"Need heart community box agency nor herself. Across lay side owner next remain.
Standard stock thought career. Eat break my draw. Public assume owner play."
10,Charles Davila,dylan44@example.com,Financial risk analyst,2023-12-25,2024-01-19,Full-Time,,,+1-316-415-2505,True situation receive perform store son believe. Single interview response growth child himself.,1992-12-02,858-77-0536,"643 Shields Radial Apt. 605
Lake Laurie, NC 58025",63093.17,Information point serious significant positive window. Mother morning speak first. Level look southern own three democratic discuss.,Huge save mind. Hear agreement but Mrs need opportunity can.,Relate yet process perform both service ahead. Population organization top capital land.,16,16,0,brucelisa@example.net,Learn several community space near both. Expert director miss look sort poor just middle. Series many tell cut research more development.,Position draw various range catch animal. Water professor work somebody. Arrive wall glass she detail.
11,Elizabeth Smith,natalie11@example.net,Health promotion specialist,2021-04-27,,Contract,Temporary,"Season million respond adult yes tough ability you. Imagine decision now.
Take traditional floor policy. About charge bed bill price while this.",597-659-5403,Republican make let next opportunity different. Knowledge open four decade real tough.,1989-11-10,456-52-1502,"489 Stephen Mountain Suite 500
West Kennethland, MH 89694",39241.71,"Develop traditional can old may likely successful go.
Always though consider politics medical. Answer break meet student situation.",Fall particular himself represent. Simple increase she small project.,"Goal last free worker.
Cold just similar she. Because factor media she. Soldier defense attack determine leave get somebody.",28,14,14,davidturner@example.com,Marriage doctor bad style ready personal attack. Across learn glass.,Here half while big day later cup. Tv order career our. Prepare consider see cold man bit nearly successful.
12,Claudia Williams DDS,shaffermichael@example.com,"Engineer, biomedical",2020-04-24,2020-07-27,Part-Time,Internship,"Voice financial actually like place oil out.
Yet red learn fly better growth race garden. Should walk from. Floor fight wait serve specific some finally.",641.608.0762x87,Contain enter senior race recent matter meeting.,1983-04-29,613-05-2537,"8904 Caroline Stravenue Suite 851
Jennyton, LA 39276",63071.80,"Nice audience nation suddenly always international such. Agreement sister chance only charge movement. Low road college green.
Rather nearly have employee. Collection professor involve vote time.",Discuss mention daughter difference option clear.,"Standard rich value mission local hear. Hope assume range chair.
Wrong effect involve. Form recently best officer seem there early.",29,11,18,martinkaitlyn@example.org,"Information interesting outside would. Represent car else affect weight employee describe. Police put wonder meet first.
Radio least even should single religious however us. With he simple.","Program step card still look likely available.
Most important form near maybe and ability. Which official I yard think why guess.
History job ahead each. Tell team arm away set thus speak."
13,Dakota Knight,jason93@example.net,Hydrologist,2020-03-27,2020-09-11,Part-Time,Internship,"Opportunity month of beautiful well. Feel spend treatment most.
Himself modern prove financial half. Set customer work look citizen sense.",3497096324,Increase before senior future director. Song law above. Water positive tree authority purpose left.,1988-12-26,763-17-6990,"288 Jennifer Cliff Apt. 046
Port Charles, LA 21700",63613.51,"Power suddenly life three. Cause ten race close among woman over. City condition letter line.
Vote before provide. Partner final today cover. Dream long simple time.",Hot brother contain loss population Congress. Power from kind.,Out staff generation herself carry. Cultural policy wife work purpose service be. From large compare put.,6,0,6,narnold@example.org,Fight recognize region ever against style accept. Know back either. Resource during long street occur.,"However hard child laugh generation economy six information. Tough very leg do.
Memory professor book international dinner rule. Last board open sister that himself.
Apply notice lead attention."
14,Mr. Cody Torres,frazierrachel@example.net,Armed forces operational officer,2020-07-21,2021-10-15,Contract,Internship,Per tend each official road. Kind skin live take hand boy trouble. Point father fight himself avoid thought class.,001-256-761-223,Go leader ball morning face money size. Face coach close minute. Must maybe future image.,1986-11-14,350-68-8421,"6208 Hernandez Green Apt. 250
Ashleyville, AL 00997",97938.36,Lead military safe both leave. Walk begin fear thing experience east yourself.,Training world million word explain hair. Without kind vote top wife all.,"Significant small picture garden. Teach although miss two hot measure admit learn. Attorney four state price.
Both likely short rate able drug recently. Walk I theory economy town sound.",20,2,18,shawna11@example.org,World those high your produce step cup this. To air college could them. Base if deal major one.,"East soldier offer according necessary success. Every everything issue his. Own drug voice plan everyone central into table.
Line phone management. Modern yet toward great. Letter detail play clear."
15,Kimberly Chavez,david44@example.net,"Loss adjuster, chartered",2019-06-13,2020-07-27,Contract,Permanent,"Recently born lot enough. Political since factor toward authority goal.
Laugh church less recognize change. Relationship mind administration quality walk computer keep.",001-737-801-020,"Service office friend four.
Leader world single life.",1987-07-05,882-34-9464,"8252 Eric Hill
Holmeston, UT 53556",66107.63,"Cost nor hundred. Win audience major pick detail share trouble. Recent sound card best half. Decision against yard happen.
Seem book peace role old. Recent wonder oil power candidate.",Rock arm every one act ability. Name our among and.,"Particularly several set admit cell see. Phone would lawyer. Fear day letter thus want past television.
Bar thing air season statement. Friend police floor past million prepare.",3,2,1,kmay@example.com,Support list note either sell. Per assume seven study. Offer miss sign more. Nor early risk pass head seat head possible.,Fire upon attention play perform half. Behind certainly whatever. Court chance soldier do agency learn.
16,Laurie Rodriguez,stephenwade@example.org,Marketing executive,2020-10-18,2023-05-06,Full-Time,Permanent,Right approach per Mrs become scene writer. Page discussion charge still. About environmental week final.,641.247.2952x07,Down brother deep factor. Medical design admit something similar.,1992-09-06,575-90-2895,"949 Andrew Viaduct Apt. 200
New Jaime, NY 42017",56292.95,"Each range place. Their thus our most rock situation other. Record store there provide animal discover yet.
Box business white smile bad special happen. Whole court air front we.",With plant how surface walk low benefit. Land tonight wide society put respond.,"Seem movement player statement about shoulder. Oil performance short book. Rather offer his medical magazine car.
Perform approach water Mrs home image brother. Friend doctor talk. Buy there buy.",28,12,16,hillstephanie@example.org,"Administration guess north special operation day. Order about wall central left get.
Money discuss player include see.
Talk value rise manager rock power. If hold simply local.",Interesting wall boy through network evening attorney. Drop speak along where. Defense return size fund choice open mention.
17,Edward Silva,matthew36@example.com,Counsellor,2022-01-26,2022-08-09,Full-Time,Permanent,"Add ok debate style show. Simply teach five hot gun soldier blood.
Drop explain condition time his example. Fund social design environmental. Loss recognize decade.
Stage go away full.",520-661-7180,Choose education about several about model. Bring several maybe street box just.,1998-08-06,853-84-9147,"1796 Cantrell Inlet
New Davidside, WI 78097",96632.50,"Military chance forward. Me between west together.
Program man skin red. Evening less fine hope something receive student me.
Fine order example nor lay able. Including mission personal.",Rock home generation section direction war. Task training here book one.,"Rich exactly star guess usually hard. Hand store final part statement force son. Sit fly foot order.
Growth discover approach. Edge relate leg politics party.",9,6,3,xsmith@example.net,Cost film skin responsibility require list. Magazine some address southern few white response. Power special base hope chair.,"Star parent citizen arrive position. Board feel half exactly under increase.
Six worry candidate full common his wife. Billion responsibility place same can."
18,Scott Garza,qpruitt@example.com,"Psychologist, educational",2023-09-14,2024-01-27,Contract,Internship,"Even wrong maintain though. Approach agreement down including follow human.
Control they she eat. Individual professional way outside official minute act.",(903)711-7160,Drive must center. Identify make summer away voice light.,2001-03-14,375-91-9810,"66644 Bradley Brooks Apt. 222
Birdview, FM 21071",43461.76,"Fish such attention boy according sing quickly. Way recently final second choice head lawyer.
My enter article ago guy miss. Act property black. Short leader single nice start class across.",Debate different sister perform student should three. Accept into yes left bit meeting like.,Rather fear peace produce. Big evidence today. Catch line quickly.,3,2,1,bradleyjohnson@example.org,"Indeed necessary southern study value. Minute stay analysis must daughter hard.
Theory security though phone. Church radio quite nothing government range.","Suddenly exactly mother. Listen walk might join.
Allow ago style half young rule anything. Window management smile network."
19,Taylor Black,hraymond@example.net,Barrister,2021-09-09,2022-05-10,Full-Time,Temporary,West end from benefit staff son. Majority professional continue order plant dark.,(834)562-4921,Or employee term game.,1992-07-30,801-57-0327,"8676 Kirk Neck Apt. 141
Bestbury, RI 51228",72347.73,"Contain send machine blood actually Mr put. Think fish then foreign. Too modern sense actually heavy.
Green music quality still. Its miss our claim collection. Compare start bad former.",Give attention much piece at different tough. We something into buy position table.,"Enough another down draw camera. Account sea hair successful fund these produce.
Single whatever your. Its put dark middle.
War beautiful scientist different store produce act season.",29,14,15,oliversharon@example.com,Television trade Mr room size. Have small sing learn. Strong peace anyone base direction again energy other.,None although here history president specific arrive. Media perhaps person so million position. Thought season wide available meet tree end long.
20,Victor Baker,charles17@example.org,Town planner,2020-07-21,2021-06-24,Contract,Temporary,"Pm space which concern turn. Baby himself around account unit. Beautiful his matter game financial TV.
Speech interview everybody development young. Process sit cut hold. Agency happy participant.",440-539-0315,Recent whatever within training need event. Position where red you hundred fast Congress.,1970-04-10,438-30-1380,"5302 Bailey Station
Dawnview, MI 04513",71447.06,Stand music they plan military. Positive material speak off son. Out how understand matter similar bad.,Threat great tend resource. Star age lose involve. Wish manage box yet treatment response.,"Market bit seek husband hour ground cover. History safe under worker let past. Cup also politics base. Entire avoid base grow draw nature.
Buy always protect right stay traditional.",18,0,18,danielle49@example.com,Use community Mrs because research audience. Current without own office hit magazine far. Work century stop before current.,Senior knowledge radio bed structure word various. Night skin plan order act sister prove.
21,Michael Smith,tinaharrison@example.net,"Engineer, biomedical",2020-01-31,2022-03-23,Contract,Permanent,"Herself process adult respond.
Need use government.
End book herself push property product individual. North letter carry Mr class audience much.
Bad meeting serious form understand never picture.",+1-992-283-9508,Ok civil herself shoulder. This at than. Remain technology five establish image green.,1992-01-03,696-18-5428,"4422 Matthew Meadows Suite 747
North Jamesshire, PA 83232",55391.43,Commercial near world citizen accept ten perhaps. Network speech run hope everyone may. Church that lay economy religious site song. Water treat do land sense.,Second least population. Blue score over off whether yet.,"Threat paper fast them.
Five natural recently team bill sea center. Enough foreign each. Together animal short detail.
She me tend oil view in. When political then.",26,7,19,jessica33@example.org,"Her claim ball myself. True enter why seven public clear respond. Affect land evidence according.
Across nor inside control offer. Measure could site first.","Answer leader its. Green really agree my. Home radio account growth poor far remain.
Experience politics soon official know wife top know. Once test service million."
22,Amy Hill,scott17@example.org,Agricultural engineer,2022-03-14,2022-04-23,Full-Time,Internship,White true history grow staff treatment. Friend cup draw already visit degree happy size. While watch upon garden.,+1-798-991-9802,Big Democrat how film structure there. Protect cut image believe.,1973-12-24,579-36-7433,"2359 Jason Plaza Apt. 955
Valdezland, WA 22352",62476.59,Religious world strategy data assume office environment shake. Wish skin matter really pick surface. Often there soon culture everybody will.,Kid public interview.,"Poor weight total despite recent four director.
Do benefit despite the. Focus small until allow son store of interest.",8,2,6,rachel89@example.net,"Far rock service article. Nor easy certainly.
Save why team song organization. Send hope through source. Full score maintain long prevent.",Region hour design unit. Number choose keep school deep animal. Test back spring hear.
23,Elijah Cooke,michaelnicholson@example.com,Structural engineer,2021-11-07,2022-11-26,Full-Time,Permanent,"Central blue well move. Available television almost others manager.
Media company guy blue. Like ability leader everybody. Family not Democrat significant or old international share.",(866)457-2548x2,Usually guy should parent someone. Better data full half. Doctor now goal fact be debate her.,1976-07-06,448-56-1069,"603 Bell Islands
New Patricia, KS 59079",89588.59,Before member east keep vote reveal affect. Traditional tend yet appear according century give long. Item senior five teacher.,Thus because choice test direction.,"Bag population usually business tend. Computer television attorney air wife no walk short. Look fast production car shoulder idea response model.
Two foot state would. Difficult whom power.",17,16,1,samuel85@example.net,Occur number approach trip account even. Story to want central. Administration she talk shoulder item similar pretty. However mean do new.,"Factor condition nor dark agreement. Long now business edge skill once reality. Couple model maybe find like night.
Their accept option use into how teacher. Church send wait huge."
