EmployeeID,EmployeeName,EmployeeEmail,EmployeeRole,EmployeeStartDate,EmployeeEndDate,EmploymentType,ContractType,ContractDetails,PhoneNumber,EmergencyContactInformation,DateOfBirth,SocialSecurityNumber,PhysicalAddress,SalaryInformation,EducationAndQualifications,WorkSchedule,PerformanceReviews,TotalDaysOff,AvailableDaysOff,RemainingDaysOff,DepartmentEmailAddresses,SpecialInformation,InternalRules
272,Katherine Cabrera,wigginsjustin@example.com,Medical laboratory scientific officer,2020-07-26,2023-05-31,Part-Time,Permanent,"Certain price along buy right cell stuff. A position shoulder section them center religious.
Game none close rather hand attention instead. Ago pull education his full car back ability.",844.677.7222,Special ask must some head particular. Mother pull card open where then.,1980-10-31,197-06-9659,"Unit 5539 Box 1398
DPO AE 98541",42649.14,"Might five than talk. Third it simple us prepare.
International interesting else have. Very mean evidence without soon whom space.",Deal team sing marriage. Benefit second visit executive ok pattern role.,Forget young build I benefit miss which anything. Painting opportunity mean quality. Too maybe forget provide consumer employee actually yes.,2,2,0,williamboyd@example.org,Herself why really listen it both industry. Course pattern structure community fall close yeah performance. Mind Mrs myself sort.,"With western what say.
Our various employee scientist. Remain manager usually later your everyone."
273,Eric Pena,andrea67@example.net,Learning mentor,2020-12-02,2022-01-23,Part-Time,Temporary,"Entire religious act determine. To not blue its describe after side anyone.
Thank animal allow trial measure will. Government suddenly several out better.",(652)407-8282,Late no heart such participant political. Term visit control know. Debate listen customer identify.,2002-09-27,494-32-7461,"0782 Davis Lake
North Matthew, IN 23577",71097.41,"Him among above Democrat their daughter. Out mission way develop onto story. Network already memory power.
Student senior player air staff hot five. Single tax camera. Ground evening low store.",Head boy could suggest professional. For TV something action can cut response. Back week who.,"Though cultural full such. Either drive necessary central southern. My most every month his.
Health defense value skill statement. Break that rather. Just meet bank produce into argue.",30,30,0,vpeterson@example.org,Do everybody suddenly including join. Everybody him last yard read group. Floor ago cell poor success whatever crime. Food mention job table score.,"Most rest reflect ability. Get prevent center family hand later born. Relationship feel administration church around.
Party ability truth game training. Task themselves entire group treat."
274,Seth Jones,lgonzalez@example.org,"Engineer, maintenance",2019-02-21,2019-11-19,Full-Time,Internship,"Including set pass class as race sea. Writer even attack. Score team glass democratic.
Meeting news tax. Little number time benefit service piece.",5664344786,Side reveal rate. Now follow treat thousand modern site. Evidence individual measure avoid.,2003-01-05,555-30-7761,"5321 Arias Rapid Suite 450
West Dustin, MS 59084",71793.54,"Lead into house program. Energy stage second positive. Deal shoulder appear seat.
Instead begin none or plant here.
Arm themselves sing claim human mother. Matter too have any can church indeed.",Age simple community war night general day.,"Realize main no what whatever full now. Let should coach benefit tough her fight budget. Election raise sing consumer me news point.
Popular time state process either would house.",28,14,14,proctorsharon@example.com,Public agreement way religious care. And situation tend strong time keep.,Possible tend cover certainly with something age trade. Third occur stop wind brother minute.
275,William Farrell,ujohns@example.net,"Lighting technician, broadcasting/film/video",2021-03-31,2022-06-23,Contract,Internship,Two majority sign power study voice particular. Prepare rate general ten less candidate success. Include decade decade report.,(915)471-1839x2,Respond indicate call everything ahead pattern else. Body may institution size early.,1993-11-14,164-93-8229,"3958 Howell Cliff Suite 406
New Jessicaberg, NH 04382",44648.57,"Loss do church through. Tend one unit yes health.
Military matter these standard. Strong occur spend become.",Choice so capital truth seek. Cost rise certainly your.,"Game voice fund cultural part. City store political same owner.
Work degree record world writer myself least. Audience Republican trade all traditional girl option ability.",18,3,15,wendy24@example.net,"During law free interest. Manage democratic people much off.
Language resource western her kitchen. Clear if vote want knowledge second network.","Yet company ability deep bag them.
Dog amount standard scene go team a soldier.
Thus Mr either federal. National ability another. Enough accept education cultural manage manage."
276,Samantha Medina,brian33@example.net,"Radiographer, diagnostic",2023-06-18,2023-10-12,Contract,Permanent,Hair rule argue actually middle. Least central heavy impact. Way treat hospital Mr focus truth without.,278-326-2646,Series best key four husband raise play. Once win four student sometimes business.,1997-01-19,841-21-5809,"3600 Scott Lodge Suite 212
Pittmanborough, WI 37903",87952.69,"Across eight floor watch. Box time common common situation make.
Great allow onto true big. Agency chair treat member although only some.",Activity speak exist fact. Stuff college later woman night two picture.,"That game those mother produce Congress. Deep cold real about. As him model. Even own eight analysis moment.
Upon my their admit fly. Reality student next soon. When look industry girl season.",3,2,1,kaitlynrodriguez@example.com,"Watch score cup wait laugh give area.
That success truth campaign south player hit. Who note television by.
Meeting help get without who. Near floor inside girl under most.",Sound produce debate student surface trade. Because onto change culture imagine fill. Perhaps rich check push take red. Free to perform base front plan serious husband.
277,Michael Washington,kimberly02@example.net,"Designer, blown glass/stained glass",2019-05-27,2023-12-11,Part-Time,Internship,"Upon Republican get woman bank debate. Against event term or third report. See heavy none certainly pretty. Feeling if you modern record performance yourself.
Which can six fast argue I drug.",3475215489,Car parent meet. Role simple despite never. Sense cut control form.,1971-01-05,321-93-0811,"857 Kimberly Bridge
Stephaniebury, SD 26402",74468.16,Very beautiful Republican either born someone ball. Perhaps beyond laugh career. Present big agent summer source account. Idea music site later add.,War ask group. Easy protect executive any. Lose street star with. Fill rest your turn.,Beautiful response personal trouble movement why. They majority spend even heart bad near. Imagine hope company.,4,0,4,nicholas31@example.com,From check woman everybody. Three company evidence development raise medical let. Ready rest officer word college measure form.,"Bring enjoy make during fish recently record respond. Join follow dark tax seven.
Although no nearly walk just. Act million be south leader."
278,Rebecca Harris,egordon@example.org,Data scientist,2023-06-03,2023-08-29,Contract,Internship,"Factor deal state worry. Go tax want across chair effect. She even because coach leave third get.
Write sound state everyone. Foot radio air travel. Country down now development me suddenly deep.",(318)842-1125x5,Girl agree street begin. Process either walk maintain enough. More easy perform dog girl instead.,1994-07-28,796-40-2190,"PSC 8700, Box 8429
APO AE 30921",52449.52,"Production lay nearly then. Note sign expect them.
Chance else even side director.",Book me size that grow. Onto guy build wonder gas rule nor produce.,Range who stuff can majority positive be. Discuss baby happy need. Purpose purpose focus region voice possible sell.,20,0,20,zcampbell@example.org,Career religious painting top difference security. Various establish wind read wide day girl wish. Live deal bed realize agree person activity. Every option live suffer government since today.,"Poor again although practice staff. Hundred face experience three management rule generation.
We machine he everybody write sense society. Teacher today three without big dark no."
279,Nicole Hicks,jacobstiffany@example.net,Occupational hygienist,2024-02-03,2024-02-06,Full-Time,Temporary,"Offer rise will when. Whether natural money.
Economic like capital fly prepare ability weight. Health line at fine around pretty. Forward image use institution.",5802753078,Carry book stop every. Well machine project fill.,1978-02-25,019-70-4857,"1018 Beth Club
Lake Larryville, HI 14246",48301.82,"Person us leader share.
Half popular series record laugh future season room. Onto figure television second.
Person adult institution should brother require.",These indicate land decide life image.,Figure production floor picture yet both officer. Reach wish system degree. Have picture bed great spend public detail.,8,7,1,vlee@example.org,Discussion need at including reflect keep care. Film short indeed same each. Green likely quality season pattern. Might sit together opportunity.,"Analysis price meet politics last though leader. Response mention rate them drug.
Marriage dog least near door. Out from edge. Wife couple protect experience present deal.
Open go involve wide."
280,Brittney Garcia,christinelawson@example.com,Physiological scientist,2023-01-14,2023-03-24,Part-Time,Permanent,"Star spring instead subject draw travel. Kitchen certainly official far. Billion bad approach adult tree.
Budget change condition how someone true. Daughter site them west necessary water.",+1-849-411-4499,Individual it draw front role employee culture. Within someone concern magazine above whom beyond.,1966-08-02,818-64-3507,"USNV Hunter
FPO AA 29706",46435.69,"Put country environmental beautiful should know toward.
Hair body training student professional hour. Ready improve make my movement maybe seek west. Pretty hundred believe develop.",One alone out.,Laugh ability message someone daughter life. Very character tax receive artist.,4,2,2,esparzachristine@example.net,Month they allow even voice business fine. Recently yard office second force training. Source rise girl north.,Heavy employee require almost receive middle. Month partner same executive become than walk hit. Behind short someone say.
281,James Maxwell,kevincarter@example.com,English as a second language teacher,2020-04-21,2021-01-15,Part-Time,Internship,"Bar which arrive economy lose quality management. Conference police discuss.
Provide major stand represent. Throw hope right with money stop opportunity.",7997745567,Sound crime for service single. There night range boy reflect.,1971-10-01,206-70-7586,"268 Garner Spring Suite 623
Bryceside, OK 48411",48896.40,"As size sit radio. Statement cup work.
Grow heavy key or behavior we. Morning source often way picture maintain threat exist.
Wrong attack goal half cell. Key statement also attorney.",Beautiful family agreement cut. Black push modern mind half. Special economy since tend.,Red service record economic represent. Mother mouth attention law seem statement. Three next act understand strong call a. Treatment actually experience.,14,0,14,jacqueline67@example.net,"View follow sport difference guess suggest. Song style about data sort writer campaign. Morning ahead recently.
Local develop rich so painting. Bed understand teach about.","Eye yes quickly lot environmental do. Over page close team goal oil affect. Someone total forget develop.
Growth lawyer material policy. Task that development up lot deal her."
282,Mrs. Kimberly Hill,kellykramer@example.org,Agricultural consultant,2021-06-12,2022-06-03,Full-Time,Internship,"Land base place strong whatever from. Foot trade ability whom stage. Particular various sometimes open.
Break rather specific health organization will enjoy. Kind parent deal beyond scene.",313-633-4517,Develop sign glass occur car. From attorney continue practice cell still.,1975-04-24,672-69-6384,"USNS Clark
FPO AE 90290",93340.72,"Little recent teach down word. After state author stop behind.
Explain evening prevent smile. Degree usually people.",Continue line forget age. Happen raise growth tax. Check such rock develop.,"Level poor top. Various nothing add wonder vote believe close. Enough among sometimes.
It provide act people. Whose major energy better position decide bed. Sit cold beat rest professor market movie.",25,17,8,kathysanchez@example.org,"Man pull easy production way particular east. Read find stock. Ground back life beautiful huge field.
Five floor necessary election. Challenge visit good thing own.","Material toward crime realize learn heart agency. Each huge speak tree month. Part employee answer never.
Item lay hand. Different culture page. Book manager save those better and."
283,Susan Conway,yangzachary@example.net,"Production assistant, radio",2021-07-30,2023-08-17,Full-Time,Permanent,Week value agree animal stage middle. Interest offer center song build. Decade serious often pay.,(654)802-0821x2,Glass wind board service hundred everything collection. Part industry capital arm.,1995-04-06,802-98-7911,"902 Ryan Streets Suite 111
Port Kevinberg, NJ 95457",35194.80,Research between purpose wife real. Buy cup ago make relate. Treat feeling argue set onto read century.,Happy sell against place build series color. Strong game wrong.,Lawyer everybody nothing parent common school itself. Walk people before pick son.,19,10,9,lesliepreston@example.com,"Stand by throw my leader. Everything quite role outside.
Guess place wall pretty turn goal. Student want shake rule. Company after city school put.
His address eat budget. Oil term myself.","Base determine visit south. Include southern wish these. Need on political.
Goal someone break point door in. Report hear nor remember light. Scientist report room pressure."
284,Henry Durham,nelsonchristopher@example.net,Acupuncturist,2020-06-14,2020-06-16,Contract,Internship,"Part model better interest yard sport who. Subject international deal weight assume current.
Decade leg business. Call bar yes hour machine share around. Skill performance shoulder peace.",(962)311-0927x1,Magazine reality put attorney level.,1987-02-15,608-02-7716,"60184 Shields Walks
South Rodney, OK 73241",97804.71,"Finally summer ago school west event. Soldier thank article.
Star against technology again mouth down almost teacher. Mouth own green money report.",Say window season analysis.,"Wonder million size respond. Specific they occur business.
Street up dog drop trial loss ahead could. Director reveal truth various model.",1,1,0,chambersbrianna@example.com,Everyone religious include. Nearly how inside left. Technology art page find enter indicate. Strong west site hard foot relationship.,Four stage to pass figure. Allow possible think federal suffer.
285,Amber Baldwin,jessicalopez@example.com,Automotive engineer,2023-05-28,2024-01-05,Contract,Temporary,Camera wear light arrive case top age practice. With situation involve drive trip study only rule. Before something wish knowledge TV.,220-821-8512,Measure enter about international. Ahead purpose mouth part a nothing.,1972-05-30,536-87-3083,"Unit 3569 Box 5191
DPO AE 04175",30478.58,"Heavy decision bill buy note. Century those student old just scientist.
Land listen those join production four member catch. Time type from. Me how suddenly and artist use many.",Light week thank guess. His create move type network.,"International series southern begin. Bed plant early across.
Pay audience ask art late very room. Much Republican college my water push Mrs. Instead cell of away answer.",5,5,0,keithtrujillo@example.com,"Job surface focus into go. Return yourself early sister product present memory.
Life push same lot. Strong art how behavior entire arm spend. Three office shake from tree.",Public beat they close. Record live itself population television. Situation young you decide beautiful public improve.
286,Paul Roberts,christopher24@example.net,"Administrator, charities/voluntary organisations",2023-01-27,2023-09-09,Part-Time,Permanent,Another road light new billion me. Reflect civil power all according. Challenge weight red answer order throw. Section story down live teach discuss sense.,(368)976-4338,Mean fish individual respond there. Any allow often group protect major.,1968-12-15,795-43-5296,"786 Nichols Walks Apt. 899
Pittsport, MO 58092",76812.57,"Those past even. Despite Mr beyond window coach south after Mr.
Quickly pass accept state lawyer them. Pressure car share bring mouth into. Pick resource employee hot modern item.",This for test order. Far money interesting style.,Very heavy add cause stage. Among few special hot friend increase relate. Century career language suddenly forget know western.,27,19,8,millerstephanie@example.net,"Mrs direction red. Become together pressure adult morning up through. Base program account lay.
Low clearly white. Image fast heavy who statement majority.","Its hundred away increase whose security drug.
Writer bring current few reach child money. Computer try often force.
Offer four again mother. Write smile morning smile hundred."
287,Judy Sanders,melissaball@example.net,Hospital pharmacist,2019-04-02,2019-11-17,Full-Time,Permanent,"Source fast know onto. Almost seat air. Song coach cause attention like husband office.
Often value foreign adult mother thank. Finally history blood with point.",(731)785-5292,"Character pick anything professor responsibility.
Could choose low size.",1986-02-03,354-42-9660,"Unit 1411 Box 4988
DPO AE 05675",50776.95,"Phone speech such morning house spend.
Space remain he yet save. Grow mouth establish himself environment look far. Hold people state mean town gun soon.",Add either writer try. Meeting none after become PM value. Herself put color hospital.,"Hope technology under tonight voice. Contain rather between. Any responsibility car.
Travel chair down like toward factor nearly. Into much purpose travel rule kind.",6,5,1,johnstonchristopher@example.com,"Building question others life. Figure bag wife nature here term commercial then.
Yeah act some some after.",Present method bring add ask senior public. Number put consumer writer. Media eight movement important those end these material.
288,Sara Peterson,nataliestewart@example.org,Horticultural therapist,2023-12-11,2024-01-24,Part-Time,Internship,"Artist forget improve name.
Man tell brother often successful try. Ok everyone guy charge.
Own sea second move. Less watch old eight make can until act.",485-369-4483,Hear technology high different per everything room. Adult about value.,1973-04-02,312-46-2025,"5354 Vega Island Apt. 218
North Timothy, AR 14360",81512.38,"Political work teacher special standard war south.
Brother something soon apply check. Finally least prevent level read size sea.
Whatever born concern push here. Movement get over fire picture.",Report main break away.,"Catch successful side edge walk. Above population him medical summer TV. Born attack very popular laugh day.
Animal attorney against conference. Interest order crime ability lawyer center thus.",1,1,0,john84@example.com,"Share along save recognize until. Recently lot whose inside check.
Water model box language into and finish whom. Option scientist center almost old law number.",Hotel entire hand or myself collection. Crime responsibility challenge truth. Majority meeting detail soldier article avoid bag.
289,Brian Santos,patricia62@example.net,Chartered accountant,2023-06-09,2023-10-03,Contract,Internship,"Job participant week test foot. Run move all relationship result.
Old final high what later. Nearly sometimes capital station generation character relate remember.",(237)941-2670x9,Her any up market truth out.,2000-06-26,397-33-6707,"Unit 1788 Box 3226
DPO AA 65471",52489.92,"Might dog question audience. Leg evening garden structure. Seven oil she however.
Parent wear help work focus. Floor small forward policy owner.",Consumer because assume rise white nearly party.,"Stop campaign though. Catch total enjoy read why produce him with. Available attorney take message.
Process mean article prepare miss imagine.",4,1,3,lowestacy@example.org,"Design such would control message could authority civil. Others someone bar service write. Business student half while.
Without mind baby police.",Pay appear there write guess arm. Sense road time vote plant similar summer. Use policy toward professional finally because detail.
290,Kyle Patel,blackdeborah@example.org,"Designer, multimedia",2020-11-15,2022-09-18,Contract,Permanent,Chance develop send growth wear trip call. Effect kitchen evidence table must change. Far ever kind. A bar help drop policy none must.,+1-560-375-6971,Week where natural character market worry in. Memory civil deep summer box audience single.,1991-11-03,361-49-6215,"1275 Rodriguez Fall Apt. 609
Hoffmanmouth, DE 80491",72287.63,"Prepare hold reach plan question. Tree hundred course.
Represent technology argue any.
Nation any specific yeah star three important.
Early war situation. Firm imagine relationship response pretty.",Final ahead hard radio fact red measure. Couple audience air how understand.,"Eat song gun minute. Look seven even happy. Us peace action certain.
Daughter character think threat yeah sign. Travel choice computer game.
Player officer then ground especially edge world.",1,1,0,crodriguez@example.net,One last school lot anything account. Suggest upon sign employee natural media pretty education. Baby side sea central dinner federal.,"System listen line rise candidate white. Hundred message line environmental. Nation enjoy ground.
Of newspaper maybe thing hand cost single."
291,Thomas Sullivan,wilsonlarry@example.net,Database administrator,2023-11-20,2023-12-04,Contract,Temporary,"Provide say me cold allow drive model. Front let about glass value range. Hard oil somebody yes wish.
Former through big friend. Education top natural how eye actually their age.",284.738.4378,Election economy you general of. Growth main management sound price tonight something.,1972-11-11,450-62-8802,"8583 Sandra Square Suite 136
Coopermouth, CO 67533",56475.12,Piece perform organization. Way movement talk development final rather. Coach major school game instead body plant plan. Recently brother effect.,Campaign else fly energy. Budget everybody may maybe if seem. Deep account traditional often same.,"Result resource possible trip. Must learn color agreement her feel. Day soldier positive behind money heart.
Finally best international stage. Range bill hard huge.",14,6,8,jessicawilkins@example.net,Gun science staff beyond. Forward democratic beyond drug statement. These move discussion staff forget. Often yet will compare store fight quickly.,"View service pressure forward body style nature. Exactly cell everything sea.
Teach spring marriage spend. Heart support believe admit ability son very.
Sign clearly those off."
292,Emily Ford,wilsonhailey@example.org,"Conservation officer, nature",2020-06-14,2024-02-04,Contract,Permanent,"Sit take newspaper oil. Number of writer fight their central.
Challenge save remember green as set. Majority page start upon whole. Provide a bill person.",338.857.7254x89,Become man first subject key gun. He yeah big rather responsibility without will his.,1982-03-19,254-90-0221,"867 Cynthia Vista Suite 516
South Dawnfurt, MA 45386",76571.11,Either summer share husband special never goal reduce. Bit hard issue next peace parent. Admit process long. Son lead pretty.,Image affect idea letter would instead. Field best face again possible generation entire.,Situation street indicate start. Keep box floor some. Figure describe language talk task participant.,4,0,4,kevincarpenter@example.com,Contain certain recent indeed present. Idea bill attention window red party easy. Account firm check back.,"Subject long blood environment college buy opportunity. Popular floor place. Hundred if listen structure people.
West whose not only. Ten energy land time such way radio."
293,Isabel Gardner,cindycurtis@example.com,"Librarian, academic",2022-05-06,2024-01-05,Part-Time,Temporary,"Fine back site issue clear. Trouble star structure management ready throw.
After PM join within. Mr sport would serious. Best go staff feel first democratic everything.",843-910-6004,Democratic late exist thank. Marriage everything senior camera event allow song.,1977-11-17,295-82-0173,"4406 Marquez Points Apt. 522
Smithstad, OR 35884",79488.89,Father stock speak buy different. Out a coach.,Hot authority everything the debate. Else top turn ball.,Position respond environment phone shoulder stop. Record leader really tax certainly even whose.,1,0,1,hmarquez@example.net,"Story feeling difficult so bit public. Second white assume decision wide.
Section care standard town he near. White between woman million room senior present. Unit society lawyer goal bag somebody.",Water industry on particular responsibility education benefit. Fire environmental perform operation fact guess.
